{
  "content": {
    "blobs": [
      {
        "base64": "iVBORw0KGgoAAAANSUhEUgAAAAEAAAABCAYAAAAfFcSJAAAADElEQVR42mNk+M/wHwAF/gL+XZR5WQAAAABJRU5ErkJggg==",
        "id": "sha256-17dea3851f35167568a1a96ecde4cdea16021c24a5ce23f509fc41544844dbdb",
        "mimeType": "image/png",
        "sha256": "17dea3851f35167568a1a96ecde4cdea16021c24a5ce23f509fc41544844dbdb"
      }
    ],
    "dependencies": {
      "audio": [],
      "meshAssets": [],
      "prefabs": [
        {
          "name": "Dogfood Boss",
          "record": {
            "behaviors": [
              {
                "action": "customScript",
                "params": {
                  "code": "/* imported as untrusted data */"
                },
                "trigger": "start"
              }
            ],
            "components": {
              "sprite-renderer": {
                "animationStates": [],
                "flipX": false,
                "flipY": false,
                "height": 0.125,
                "initialAnimationStateRef": null,
                "initialDirection": "none",
                "opacity": 1,
                "orderInLayer": 0,
                "parallaxLayerRef": null,
                "pivotX": 0.5,
                "pivotY": 0.5,
                "playOnStart": false,
                "renderMode": "simple",
                "sortingLayerRef": "world",
                "sourceTexture": null,
                "spriteAssetRef": "sprite-9",
                "tint": "#ffffff",
                "version": 9,
                "visible": true,
                "width": 0.125
              }
            },
            "id": "boss-source",
            "kind": "sprite"
          }
        },
        {
          "name": "Dogfood Elite",
          "record": {
            "behaviors": [
              {
                "action": "spawn",
                "params": {
                  "prefabName": "Dogfood Enemy"
                },
                "trigger": "start"
              }
            ],
            "id": "elite-source",
            "kind": "cube",
            "sourcePrefabName": "Dogfood Enemy"
          }
        },
        {
          "name": "Dogfood Enemy",
          "record": {
            "components": {
              "sprite-renderer": {
                "animationStates": [],
                "flipX": false,
                "flipY": false,
                "height": 0.125,
                "initialAnimationStateRef": null,
                "initialDirection": "none",
                "opacity": 1,
                "orderInLayer": 0,
                "parallaxLayerRef": null,
                "pivotX": 0.5,
                "pivotY": 0.5,
                "playOnStart": false,
                "renderMode": "simple",
                "sortingLayerRef": "world",
                "sourceTexture": null,
                "spriteAssetRef": "sprite-0",
                "tint": "#ffffff",
                "version": 9,
                "visible": true,
                "width": 0.125
              }
            },
            "id": "enemy-source",
            "kind": "sprite"
          }
        }
      ],
      "sortingLayers": [
        {
          "id": "world",
          "name": "World",
          "order": 4
        }
      ],
      "spriteAnimations": [],
      "spriteAssets": [
        {
          "filtering": "nearest",
          "id": "sprite-0",
          "name": "Dogfood Sprite 0",
          "nineSlice": null,
          "pivot": [
            0.5,
            0.5
          ],
          "pixelsPerUnit": 8,
          "sourceRect": null,
          "sourceTexture": "atlas-a",
          "type": "sprite",
          "version": 4
        },
        {
          "filtering": "nearest",
          "id": "sprite-1",
          "name": "Dogfood Sprite 1",
          "nineSlice": null,
          "pivot": [
            0.5,
            0.5
          ],
          "pixelsPerUnit": 8,
          "sourceRect": null,
          "sourceTexture": "atlas-a",
          "type": "sprite",
          "version": 4
        },
        {
          "filtering": "nearest",
          "id": "sprite-2",
          "name": "Dogfood Sprite 2",
          "nineSlice": null,
          "pivot": [
            0.5,
            0.5
          ],
          "pixelsPerUnit": 8,
          "sourceRect": null,
          "sourceTexture": "atlas-a",
          "type": "sprite",
          "version": 4
        },
        {
          "filtering": "nearest",
          "id": "sprite-3",
          "name": "Dogfood Sprite 3",
          "nineSlice": null,
          "pivot": [
            0.5,
            0.5
          ],
          "pixelsPerUnit": 8,
          "sourceRect": null,
          "sourceTexture": "atlas-a",
          "type": "sprite",
          "version": 4
        },
        {
          "filtering": "nearest",
          "id": "sprite-4",
          "name": "Dogfood Sprite 4",
          "nineSlice": null,
          "pivot": [
            0.5,
            0.5
          ],
          "pixelsPerUnit": 8,
          "sourceRect": null,
          "sourceTexture": "atlas-a",
          "type": "sprite",
          "version": 4
        },
        {
          "filtering": "nearest",
          "id": "sprite-5",
          "name": "Dogfood Sprite 5",
          "nineSlice": null,
          "pivot": [
            0.5,
            0.5
          ],
          "pixelsPerUnit": 8,
          "sourceRect": null,
          "sourceTexture": "atlas-b",
          "type": "sprite",
          "version": 4
        },
        {
          "filtering": "nearest",
          "id": "sprite-6",
          "name": "Dogfood Sprite 6",
          "nineSlice": null,
          "pivot": [
            0.5,
            0.5
          ],
          "pixelsPerUnit": 8,
          "sourceRect": null,
          "sourceTexture": "atlas-b",
          "type": "sprite",
          "version": 4
        },
        {
          "filtering": "nearest",
          "id": "sprite-7",
          "name": "Dogfood Sprite 7",
          "nineSlice": null,
          "pivot": [
            0.5,
            0.5
          ],
          "pixelsPerUnit": 8,
          "sourceRect": null,
          "sourceTexture": "atlas-b",
          "type": "sprite",
          "version": 4
        },
        {
          "filtering": "nearest",
          "id": "sprite-8",
          "name": "Dogfood Sprite 8",
          "nineSlice": null,
          "pivot": [
            0.5,
            0.5
          ],
          "pixelsPerUnit": 8,
          "sourceRect": null,
          "sourceTexture": "atlas-b",
          "type": "sprite",
          "version": 4
        },
        {
          "filtering": "nearest",
          "id": "sprite-9",
          "name": "Dogfood Sprite 9",
          "nineSlice": null,
          "pivot": [
            0.5,
            0.5
          ],
          "pixelsPerUnit": 8,
          "sourceRect": null,
          "sourceTexture": "atlas-b",
          "type": "sprite",
          "version": 4
        }
      ],
      "textures": [
        {
          "blobRef": "sha256-17dea3851f35167568a1a96ecde4cdea16021c24a5ce23f509fc41544844dbdb",
          "id": "atlas-a",
          "name": "Dogfood Atlas A"
        },
        {
          "blobRef": "sha256-17dea3851f35167568a1a96ecde4cdea16021c24a5ce23f509fc41544844dbdb",
          "id": "atlas-b",
          "name": "Dogfood Atlas B"
        }
      ],
      "tilesets": [
        {
          "autoTileSets": [
            {
              "defaultTileId": "tile-0",
              "id": "roads",
              "name": "Roads",
              "neighborMode": "four-way",
              "rules": [
                {
                  "mask": 0,
                  "tileId": "tile-0"
                },
                {
                  "mask": 10,
                  "tileId": "tile-1"
                }
              ]
            }
          ],
          "cellSize": {
            "height": 1,
            "width": 1
          },
          "id": "dogfood-tileset",
          "name": "Phase 039 Dogfood Tiles",
          "terrainBrushes": [
            {
              "id": "meadow",
              "mode": "weighted-tiles",
              "name": "Meadow",
              "seed": 39,
              "variants": [
                {
                  "tileId": "tile-2",
                  "weight": 3
                },
                {
                  "tileId": "tile-3",
                  "weight": 1
                }
              ]
            },
            {
              "autoTileSetId": "roads",
              "id": "connected-meadow",
              "mode": "auto-tile",
              "name": "Connected Meadow",
              "seed": 0,
              "variants": []
            }
          ],
          "tiles": [
            {
              "collision": {
                "mode": "none"
              },
              "id": "tile-0",
              "name": "Tile 0",
              "spriteAssetRef": "sprite-0"
            },
            {
              "collision": {
                "mode": "full-cell"
              },
              "id": "tile-1",
              "name": "Tile 1",
              "spriteAssetRef": "sprite-1"
            },
            {
              "collision": {
                "mode": "full-cell"
              },
              "id": "tile-2",
              "name": "Tile 2",
              "spriteAssetRef": "sprite-2"
            },
            {
              "collision": {
                "mode": "none"
              },
              "id": "tile-3",
              "name": "Tile 3",
              "spriteAssetRef": "sprite-3"
            },
            {
              "collision": {
                "mode": "full-cell"
              },
              "id": "tile-4",
              "name": "Tile 4",
              "spriteAssetRef": "sprite-4"
            },
            {
              "collision": {
                "mode": "full-cell"
              },
              "id": "tile-5",
              "name": "Tile 5",